<?xml version="1.0" encoding="UTF-8"?>
<xs:schema xmlns:xs="http://www.w3.org/2001/XMLSchema" elementFormDefault="qualified" attributeFormDefault="unqualified">
    <xs:element name="Employees" type="EmployeesType"/>
    <xs:complexType name="EmployeesType">
        <xs:sequence>
            <xs:element name="Employee" type="EmployeeType" maxOccurs="unbounded"/>
        </xs:sequence>
    </xs:complexType>
    <xs:complexType name="EmployeeType">
        <xs:sequence>
            <xs:element name="age" type="xs:int"/>
            <xs:element name="name" type="xs:string"/>
            <xs:element name="gender" type="xs:string"/>
            <xs:element name="role" type="xs:string"/>
        </xs:sequence>
        <xs:attribute name="id" type="xs:int" use="required"/>
    </xs:complexType>
</xs:schema>
